"symbol","name","sector","industry","country","website","market_cap","pe_ratio","dividend_yield","52_week_high","52_week_low","description"
"INTC","Intel Corporation","Technology","Semiconductors","United States","https://www.intel.com",193184989184,675.0,0.0,44.02,17.67,"Intel Corporation designs, develops, manufactures, markets, and sells computing and related products and services worldwide. It operates through Intel Products, Intel Foundry, and All Other segments. The company offers microprocessor and chipset, stand-alone SoC, and multichip package; Computer Systems and Devices; hardware products comprising CPUs, graphics processing units (GPUs), accelerators, and field programmable gate arrays (FPGAs); and memory and storage, connectivity and networking, and other semiconductor products. It also offers silicon and software products; and optimization solutions for workloads, such as AI, cryptography, security, storage, networking, and leverages various features supporting diverse compute environments. In addition, the company provides driving assistance and self-driving solutions; advanced process technologies enabled by an ecosystem of electronic design automation tools, intellectual property, and design services, as well as systems of chips, including advanced packaging technologies, software, and system. Further, it delivers and deploys intelligent edge platforms that allow developers to achieve agility and drive automation using AI for efficient operations with data integrity, as well as provides hardware and software platforms, tools, and ecosystem partnerships for digital transformation from the cloud to edge. The company serves original equipment manufacturers, original design manufacturers, cloud service providers, and other manufacturers and service providers. Intel Corporation was incorporated in 1968 and is headquartered in Santa Clara, California."
"JNJ","Johnson & Johnson","Healthcare","Drug Manufacturers - General","United States","https://www.jnj.com",481762672640,19.338491,258.0,207.81,140.68,"Johnson & Johnson, together with its subsidiaries, engages in the research and development, manufacture, and sale of various products in the healthcare field worldwide. It operates in two segments, Innovative Medicine and MedTech. The Innovative Medicine segment offers products for various therapeutic areas, such as immunology, including rheumatoid arthritis, psoriatic arthritis, inflammatory bowel disease, and psoriasis; infectious diseases comprising HIV/AIDS; neuroscience, consisting of mood disorders, neurodegenerative disorders, and schizophrenia; oncology, such as prostate cancer, hematologic malignancies, lung cancer, and bladder cancer; cardiovascular and metabolism, including thrombosis, diabetes, and macular degeneration; and pulmonary hypertension comprising pulmonary arterial hypertension through retailers, wholesalers, distributors, hospitals, and healthcare professionals for prescription use. The MedTech segment provides electrophysiology products to treat heart rhythm disorders; the heart recovery portfolio, which includes technologies to treat severe coronary artery disease requiring high-risk PCI or AMI cardiogenic shock; circulatory restoration products for the treatment of calcified coronary artery and peripheral artery diseases; and neurovascular care that treats hemorrhagic and ischemic stroke. This segment offers an orthopaedics portfolio that includes products and enabling technologies that support hips, knees, trauma, spine, sports, and other; surgery portfolios comprising advanced and general surgery technologies, as well as solutions for breast aesthetics and reconstruction; contact lenses under the ACUVUE brand; and TECNIS intraocular lenses for cataract surgery. It distributes its products to wholesalers, hospitals, and retailers, as well as physicians, nurses, hospitals, eye care professionals, and clinics. The company was founded in 1886 and is based in New Brunswick, New Jersey."
"JPM","JP Morgan Chase & Co.","Financial Services","Banks - Diversified","United States","https://www.jpmorganchase.com",826328547328,14.876733,190.0,322.25,202.16,"JPMorgan Chase & Co. operates as a financial services company worldwide. It operates through three segments: Consumer & Community Banking, Commercial & Investment Bank, and Asset & Wealth Management. The company offers deposit, investment and lending products, cash management, and payments and services; mortgage origination and servicing activities; residential mortgages and home equity loans; and credit cards, auto loans, leases, and travel services to consumers and small businesses through bank branches, ATMs, and digital and telephone banking. It also provides investment banking products and services, including corporate strategy and structure advisory, and equity and debt market capital-raising services, as well as loan origination and syndication; payments; and cash and derivative instruments, risk management solutions, prime brokerage, and research, as well as offers securities services, including custody, fund services, liquidity, and trading services, and data solutions products. In addition, the company provides financial solutions, including lending, payments, investment banking, and asset management to small and midsized companies, local governments, nonprofit clients, and municipalities, as well as commercial real estate clients. Further, it offers multi-asset investment management solutions in equities, fixed income, alternatives, and money market funds to institutional clients and retail investors; and retirement products and services, brokerage, custody, estate planning, lending, deposits, and investment management products to high net worth clients. The company was founded in 1799 and is headquartered in New York, New York."
"KO","Coca-Cola Company (The)","Consumer Defensive","Beverages - Non-Alcoholic","United States","https://www.coca-colacompany.com",301644021760,23.208609,291.0,74.38,60.62,"The Coca-Cola Company, a beverage company, manufactures and sells various nonalcoholic beverages in the United States and internationally. The company provides sparkling soft drinks and flavors; water, sports, coffee, and tea; juice, value-added dairy, and plant-based beverages; and other beverages. It also offers beverage concentrates and syrups, as well as fountain syrups to fountain retailers comprising restaurants and convenience stores. The company sells its products under the Coca-Cola, Diet Coke/Coca-Cola Light, Coca-Cola Zero Sugar, caffeine free Diet Coke, Cherry Coke, Fanta Orange, Fanta Zero Orange, Fanta Zero Sugar, Fanta Apple, Sprite, Sprite Zero Sugar, Simply Orange, Simply Apple, Simply Grapefruit, Fresca, Schweppes, Thums Up, Aquarius, Ayataka, BODYARMOR, Ciel, Costa, Crystal, Dasani, dogadan, Fuze Tea, Georgia, glacéau smartwater, glacéau vitaminwater, Gold Peak, I LOHAS, Powerade, Topo Chico, Core Power, Del Valle, fairlife, innocent, Maaza, Minute Maid, Minute Maid Pulpy, and Simply brands. It operates through a network of independent bottling partners, distributors, wholesalers, and retailers, as well as through bottling and distribution operators. The company was founded in 1886 and is headquartered in Atlanta, Georgia."
"MCD","McDonald's Corporation","Consumer Cyclical","Restaurants","United States","https://www.mcdonalds.com",221781114880,26.540564,239.0,326.32,276.53,"McDonald's Corporation owns, operates, and franchises restaurants under the McDonald's brand in the United States and internationally. It offers food and beverages, including hamburgers and cheeseburgers, various chicken sandwiches, fries, shakes, desserts, sundaes, soft serve cones, cookies, pies, soft drinks, coffee, and other beverages; and full or limited breakfast, as well as sells various other products during limited-time promotions. The company owns and operates franchised restaurants under various structures, including conventional franchise, developmental license, or affiliate. McDonald's Corporation was founded in 1940 and is based in Chicago, Illinois."
"MMM","3M Company","Industrials","Conglomerates","United States","https://www.3m.com",87931838464,26.372204,174.0,174.69,121.98,"3M Company provides diversified technology services in the Americas, the Asia Pacific, Europe, the Middle East, Africa, and internationally. It operates through three segments: Safety and Industrial, Transportation and Electronics, and Consumer. The Safety and Industrial segment offers industrial abrasives and finishing for metalworking applications; autobody repair solutions; industrial specialty products, such as personal hygiene products, masking, and packaging materials; electrical products and materials for construction and maintenance, power distribution, and electrical original equipment manufacturers; structural adhesives and tapes; respiratory, hearing, eye, and fall protection solutions; and mineral granules for shingles. The Transportation and Electronics segment provides ceramic solutions; attachment/bonding, films, sound, and temperature management for transportation vehicles; format graphic films for advertising and fleet signage; reflective signage for highway and vehicle safety; light management films and electronics assembly solutions; chip packaging and interconnection solutions; semiconductor production materials; and data center solutions. The Consumer segment offers cleaning products for the home; consumer air quality products; picture hanging accessories; retail abrasives, paint accessories, and safety products; stationery and office products; automotive appearance products; and consumer bandages, tapes, braces, and supports. The company offers its products through e-commerce and traditional wholesalers, retailers, jobbers, distributors, and dealers, as well as directly to users. 3M Company was founded in 1902 and is headquartered in Saint Paul, Minnesota."
"MRK","Merck & Company, Inc.","Healthcare","Drug Manufacturers - General","United States","https://www.merck.com",242010226688,12.816137,341.0,105.84,73.31,"Merck & Co., Inc. operates as a healthcare company worldwide. The company offers human health pharmaceutical for various areas under the Keytruda, Welireg, Gardasil, ProQuad, M-M-R II, Varivax, Vaxneuvance, RotaTeq, Pneumovax 23, Bridion, Dificid, Zerbaxa, Noxafil, Winrevair, Adempas, Verquvo, Lagevrio, Isentress/Isentress HD, Delstrigo, Pifeltro, Belsomra, Januvia, and Janumet brands. It also provides veterinary pharmaceuticals, vaccines and health management solutions and services, such as livestock products under the Nuflor, Bovilis/Vista, Bovilis Cryptium, Banamine, Estrumate, Matrix, Resflor, Zuprevo, Revalor, Safe-Guard, M+Pac, Porcilis, Circumvent, Nobilis/Innovax, Paracox and Coccivac, Exzolt, Slice, Imvixa, Clynav, Aquavac/Norvax, Aquaflor, Flexolt brands; Allflex Livestock Intelligence solutions; and companion animal products under the Bravecto One-Month, Bravecto Injectable/Quantum, Bravecto Plus, Sentinel Spectrum, Sentinel Flavor Tabs, Optimmune, Nobivac NXT, GilvetMab, Otomax, Mometamax, Mometamax Ultra, Posatex, Caninsulin/Vetsulin, Panacur, Regumate, Prestige, Scalibor/Exspot, Sure Petcare, and Home Again brands. The company has development and commercialization agreement for three of Daiichi Sankyo's deruxtecan ADC candidates; AstraZeneca PLC to co-development and co-commercialize AstraZeneca's Lynparza products for multiple cancer types, and Koselugo for multiple indications; licensed to develop, manufacture and commercialize LM-299, a novel investigational PD-1/VEGF bispecific antibody from LaNova; and collaboration agreement with Eisai Co., Ltd., Bayer AG, and Ridgeback Biotherapeutics LP, as well Moderna, Inc. It has a collaboration agreement with Antengene Corporation Limited to evaluate the combination of ATG-022, a CLDN18.2-targeting antibody-drug conjugate, and anti-PD-1 therapy, as well as KEYTRUDA (pembrolizumab) in patients with advanced solid tumors. Merck & Co., Inc. was founded in 1891 and is headquartered in Rahway, New Jersey."
"MSFT","Microsoft Corporation","Technology","Software - Infrastructure","United States","https://www.microsoft.com",3657266364416,34.99431,75.0,555.45,344.79,"Microsoft Corporation develops and supports software, services, devices, and solutions worldwide. The company's Productivity and Business Processes segment offers Microsoft 365 Commercial, Enterprise Mobility + Security, Windows Commercial, Power BI, Exchange, SharePoint, Microsoft Teams, Security and Compliance, and Copilot; Microsoft 365 Commercial products, such as Windows Commercial on-premises and Office licensed services; Microsoft 365 Consumer products and cloud services, such as Microsoft 365 Consumer subscriptions, Office licensed on-premises, and other consumer services; LinkedIn; Dynamics products and cloud services, such as Dynamics 365, cloud-based applications, and on-premises ERP and CRM applications. Its Intelligent Cloud segment provides Server products and cloud services, such as Azure and other cloud services, GitHub, Nuance Healthcare, virtual desktop offerings, and other cloud services; Server products, including SQL and Windows Server, Visual Studio and System Center related Client Access Licenses, and other on-premises offerings; Enterprise and partner services, including Enterprise Support and Nuance professional Services, Industry Solutions, Microsoft Partner Network, and Learning Experience. The company's Personal Computing segment provides Windows and Devices, such as Windows OEM licensing and Devices and Surface and PC accessories; Gaming services and solutions, such as Xbox hardware, content, and services, first- and third-party content Xbox Game Pass, subscriptions, and Cloud Gaming, advertising, and other cloud services; search and news advertising services, such as Bing and Copilot, Microsoft News and Edge, and third-party affiliates. It sells its products through OEMs, distributors, and resellers; and online and retail stores. The company was founded in 1975 and is headquartered in Redmond, Washington."
"NKE","Nike, Inc.","Consumer Cyclical","Footwear & Accessories","United States","https://www.nike.com",93614497792,32.476925,249.00000000000003,82.44,52.28,"NIKE, Inc., together with its subsidiaries, designs, develops, markets, and sells athletic and casual footwear, apparel, equipment, accessories, and services for men, women, and kids in North America, Europe, the Middle East, Africa, Greater China, the Asia Pacific, and Latin America. The company offers its products under the NIKE, Jordan, Jumpman, Converse, Chuck Taylor, All Star, One Star, Star Chevron, and Jack Purcell trademarks. It also provides a line of performance equipment and accessories, including bags, socks, sport balls, eyewear, timepieces, digital devices, bats, gloves, protective equipment, and other equipment for sports activities, as well as various plastic products to other manufacturers; distributes and licenses casual sneakers, apparel, and accessories; and markets apparel with licensed college and professional team and league logos. In addition, the company offers consumer services and experiences, including sport focused events and activations; fitness and activity apps; sport, fitness, and wellness content; and digital services and features in retail stores. It sells its products to footwear stores; sporting goods stores; athletic specialty stores; department stores; skate, tennis, and golf shops; and other wholesale accounts through NIKE-owned retail stores, independent distributors, licensees, sales representatives, and digital platforms. The company was formerly known as Blue Ribbon Sports, Inc. and changed its name to NIKE, Inc. in May 1971. NIKE, Inc. was founded in 1964 and is headquartered in Beaverton, Oregon."
"PG","Procter & Gamble Company (The)","Consumer Defensive","Household & Personal Products","United States","https://www.pginvestor.com",326801981440,20.383942,295.0,179.99,138.14,"The Procter & Gamble Company provides branded consumer packaged goods worldwide. It operates through Beauty; Grooming; Health Care; Fabric & Home Care; and Baby, Feminine & Family Care segments. The company offers conditioners, shampoos, styling aids, and treatments under the Head & Shoulders, Herbal Essences, Pantene, and Rejoice brands; antiperspirants, deodorants, and personal cleansing products under the Native, Old Spice, Safeguard, and Secret brands; and facial moisturizers, cleaners, and treatments under the Olay and SK-II brands. It also provides blades, razors, shave products, appliances, and other grooming products under the Braun, Gillette, and Venus brands. In addition, the company offers toothbrushes, toothpastes, and other oral care products under the Crest and Oral-B brands; and gastrointestinal, pain relief, rapid diagnostics, respiratory, vitamins/minerals/supplements, and other personal health care products under the Metamucil, Neurobion, Pepto-Bismol, and Vicks brands. Further, it provides fabric enhancers, and laundry additives and detergents under the Ariel, Downy, Gain, and Tide brands; and air and dish care, P&G professional, and surface care under the Cascade, Dawn, Fairy, Febreze, Mr. Clean, and Swiffer brands. Additionally, the company offers baby wipes, and taped diapers and pants under the Luvs and Pampers brands; adult incontinence and menstrual care products under the Always, Always Discreet, and Tampax brands; and paper towels, tissues, and toilet papers under the Bounty, Charmin, and Puffs brands. It sells its products through mass merchandisers, social and e-commerce channels, grocery and specialty beauty stores, membership club stores, drug and department stores, distributors, wholesalers, airport duty-free and high-frequency stores, pharmacies, electronics stores, and professional channels, as well as directly to consumers. The Procter & Gamble Company was founded in 1837 and is headquartered in Cincinnati, Ohio."
"TRV","The Travelers Companies, Inc.","Financial Services","Insurance - Property & Casualty","United States","https://www.travelers.com",62848364544,10.986226,157.0,296.85,230.23,"The Travelers Companies, Inc., through its subsidiaries, provides a range of commercial and personal property, and casualty insurance products and services to businesses, government units, associations, and individuals in the United States and internationally. The company operates through three segments: Business Insurance, Bond & Specialty Insurance, and Personal Insurance. The Business Insurance segment offers workers' compensation, commercial automobile and property, general liability, commercial multi-peril, employers' liability, public and product liability, professional indemnity, marine, aviation, onshore and offshore energy, construction, terrorism, personal accident, and kidnap and ransom insurance products. This segment operates through select accounts, which serve small businesses; commercial accounts that serve mid-sized businesses; national accounts, which serve large companies; and national property and other that serve large and mid-sized customers, commercial trucking industry, and agricultural businesses, as well as markets and distributes its products through brokers, wholesale agents, and program managers. The Bond & Specialty Insurance segment provides surety, fidelity, management and professional liability, and other property and casualty coverages and related risk management services through independent agencies and brokers. The Personal Insurance segment offers property and casualty insurance covering personal risks, primarily automobile and homeowners' insurance to individuals through independent agencies and brokers. The Travelers Companies, Inc. was founded in 1853 and is based in New York, New York."
"UNH","UnitedHealth Group Incorporated","Healthcare","Healthcare Plans","United States","https://www.unitedhealthgroup.com",293129388032,16.86295,267.0,606.36,234.6,"UnitedHealth Group Incorporated operates as a health care company in the United States and internationally. The company operates through four segments: UnitedHealthcare, Optum Health, Optum Insight, and Optum Rx. The UnitedHealthcare segment offers consumer-oriented health benefit plans and services for national employers, public sector employers, mid-sized employers, small businesses, and individuals; health care coverage, and health and well-being services to individuals age 50 and older; Medicaid plans, children's health insurance and health care programs; and health care benefits products and services to state programs caring for the economically disadvantaged, medically underserved, and those without the benefit of employer-funded health care coverage. The Optum Health segment provides care delivery, care management, wellness and consumer engagement, and health financial services patients, consumers, care delivery systems, providers, employers, payers, and public-sector entities. The Optum Insight segment offers software and information products, advisory consulting arrangements, and managed services outsourcing contracts to hospital systems, physicians, health plans, governments, life sciences companies, and other organizations. The Optum Rx segment provides pharmacy care services and programs, including retail network contracting, home delivery, specialty and community health pharmacy services, infusion, and purchasing and clinical capabilities, as well as develops programs in the areas of step therapy, formulary management, drug adherence, and disease and drug therapy management. UnitedHealth Group Incorporated was founded in 1974 and is based in Eden Prairie, Minnesota."
"V","Visa Inc.","Financial Services","Credit Services","United States","https://www.visa.com",633717522432,32.009804,81.0,375.51,299.0,"Visa Inc. operates as a payment technology company in the United States and internationally. The company operates VisaNet, a transaction processing network that enables authorization, clearing, and settlement of payment transactions. It also offers credit, debit, and prepaid card products; tap to pay, tokenization, and click to pay services; Visa Direct, a platform which facilitates money movement, enabling clients to collect, hold, convert, and send funds across its network; and issuing solutions, such as airport lounge access, dining reservations, shopping experiences, event tickets, and seller offers. In addition, the company provides acceptance solutions, an omnichannel payment integration with e-commerce platforms; risk detection and prevention solutions; and advisory and other services comprising consulting practice, proprietary analytics models, data scientists and economists, marketing services, and managed services. It provides its services under the Visa, Visa Electron, V PAY, Interlink, and PLUS brands. The company serves consumers, sellers, financial institutions, and government entities. Visa Inc. was founded in 1958 and is headquartered in San Francisco, California."
"VZ","Verizon Communications Inc.","Communication Services","Telecom Services","United States","https://www.verizon.com",169247309824,8.558635,662.0,47.36,37.59,"Verizon Communications Inc., through its subsidiaries, engages in the provision of communications, technology, information, and entertainment products and services to consumers, businesses, and governmental entities worldwide. It operates in two segments, Verizon Consumer Group (Consumer) and Verizon Business Group (Business). The Consumer segment provides wireless services across the wireless networks in the United States under the Verizon and TracFone brands and through wholesale and other arrangements; and fixed wireless access (FWA) broadband through its wireless networks, as well as related equipment and devices, such as smartphones, tablets, smart watches, and other wireless-enabled connected devices. The segment also offers wireline services in the Mid-Atlantic and Northeastern United States, as well as Washington D.C. through its fiber-optic network, Verizon Fios product portfolio, and a copper-based network. The Business segment provides wireless and wireline communications services and products, including FWA broadband, data, video and conferencing, corporate networking, security and managed network, local and long-distance voice, and network access services to deliver various IoT services and products to businesses, government customers, and wireless and wireline carriers in the United States and internationally. The company was formerly known as Bell Atlantic Corporation and changed its name to Verizon Communications Inc. in June 2000. Verizon Communications Inc. was incorporated in 1983 and is headquartered in New York, New York."
"WBA","","","","","",0,0.0,0.0,0.0,0.0,""
